YEAR,JOURNAL,TITLE,DOI
2015,Behavioral Ecology and Sociobiology,Effects of carotenoid supplementation and oxidative challenges on physiological parameters and carotenoid-based coloration in an urbanization context,10.1007/s00265-015-1908-y
2015,Landscape Ecology,Defining and measuring urban sustainability: A review of indicators,10.1007/s10980-015-0208-2
2015,Landscape and Urban Planning,A multidimensional classification and equity analysis of an urban park system: A novel methodology and case study application,10.1016/j.landurbplan.2014.12.014
2015,Urban Ecosystems,Comparative study of urban ecology development in the U.S. and China: Opportunity and challenge,10.1007/s11252-014-0413-9
2015,Global Change Biology,Impacts of altered precipitation regimes on soil communities and biogeochemistry in arid and semi-arid ecosystems,10.1111/gcb.12789
2015,Landscape and Urban Planning,An ecohydrological approach to conserving urban water through optimized landscape irrigation schedules,10.1016/j.landurbplan.2014.09.012
2016,Landscape Ecology,"Micro-scale urban surface temperatures are related to land-cover features and residential heat related health impacts in Phoenix, AZ USA",10.1007/s10980-015-0284-3
2016,Landscape and Urban Planning,"When the economic engine stalls – a multi-scale comparison of vegetation dynamics in pre- and post-recession Phoenix, Arizona, USA",10.1016/j.landurbplan.2016.05.009
2016,Landscape Ecology,Seasonally varied controls of climate and phenophase on terrestrial carbon dynamics: Modeling eco-climate system state using Dynamical Process Networks,10.1007/s10980-015-0253-x
2016,Ecological Engineering,Aridland constructed treatment wetlands II: Plant mediation of surface hydrology enhances nitrogen removal,10.1016/j.ecoleng.2016.01.002
2016,Landscape and Urban Planning,Lawn enforcement: How municipal policies and neighborhood norms influence homeowner residential landscape management,10.1016/j.landurbplan.2016.02.011
2016,Landscape and Urban Planning,"Hot playgrounds and children's health: A multiscale analysis of surface temperatures in Arizona, USA",10.1016/j.landurbplan.2015.10.007
2017,Journal of Arid Environments,Seasonality and land cover characteristics drive aphid dynamics in an arid city,10.1016/j.jaridenv.2017.04.007
2017,Landscape and Urban Planning,Decadal declines in bird abundance and diversity in urban riparian zones,10.1016/j.landurbplan.2016.09.026
2017,Ecosphere,"Confirming a plant-mediated ""Biological Tide"" in an aridland constructed treatment wetland",10.1002/ecs2.1756
2017,European Journal of Soil Biology,Soil microbial community composition is correlated to soil carbon processing along a boreal wetland formation gradient,10.1016/j.ejsobi.2017.08.001
2017,Behavioral Ecology and Sociobiology,The effects of urbanization and human disturbance on problem solving in juvenile house finches (Haemorhous mexicanus),10.1007/s00265-017-2304-6
2017,Landscape and Urban Planning,Legacy effects and landscape choices in a desert city,10.1016/j.landurbplan.2017.04.014
2017,Restoration Ecology,Water quality implications of hydrologic restoration alternatives in the Florida Everglades United States,10.1111/rec.12513
2017,Ecosphere,Boom-bust economics and vegetation dynamics in a desert city: How strong is the link?,10.1002/ecs2.1826
2017,Landscape and Urban Planning,"Optimizing green space locations to reduce daytime and nighttime urban heat island effects in Phoenix, Arizona",10.1016/j.landurbplan.2017.04.009
2018,Landscape and Urban Planning,"Waterbird community composition, abundance, and diversity along an urban gradient",10.1016/j.landurbplan.2017.11.003
2018,Global Change Biology,Global change‐driven effects on dissolved organic matter composition: Implications for food webs of northern lakes,10.1111/gcb.14129
2018,Behavioral Ecology,Expression of and choice for condition-dependent carotenoid-based color in an urbanizing context,10.1093/beheco/ary093
2018,Molecular Ecology,Urbanization as a facilitator of gene flow in a human health pest,10.1111/mec.14783
2018,Global Change Biology,A review of urban impacts on avian life‐history evolution: Does city living lead to slower pace of life?,10.1111/gcb.13969
2018,Landscape and Urban Planning,Avian anthrophobia? Behavioral and physiological responses of house finches (Haemorhous mexicanus) to human and predator threats across an urban gradient,10.1016/j.landurbplan.2018.07.001
1983,Ecology,The influence of neighboring hosts on colonization of prairie milkweeds by a seed-feeding bug,10.2307/1937184
1984,Oikos,Fire as a natural disturbance to grasshopper assemblages of tallgrass prairie,10.2307/3544239
1984,Journal of Wildlife Management,Preferences and influence of paired food items on energy intake of American robins and gray catbirds,10.2307/3808471
1984,American Midland Naturalist,Nitrogen and phosphorus resorption dynamics of five tree species in a Kansas gallery forest,10.2307/2425554
1984,American Midland Naturalist,Belowground macroarthropods of annually burned and unburned tallgrass prairie,10.2307/2425336
1985,American Midland Naturalist,Fire history of oak gallery forests in a northeast Kansas tallgrass prairie,10.2307/2425255
1985,Ecology,Autumnal resorption and accretion of trace metals in gallery forest trees,10.2307/1941329
1985,Ecology,Effect of fire and drought on the ecophysiology of Andropogon gerardii and Panicum virgatum in a tallgrass prairie,10.2307/1939184
1986,Ecology,Nitrogen mineralization by native and introduced earthworms: effects on big bluestem growth,10.2307/1939833
1986,American Midland Naturalist,Litterfall dynamics and element use efficiency in a Kansas gallery forest,10.2307/2425950
1986,American Midland Naturalist,Leaf litter processing and the associated invertebrate fauna in a tallgrass prairie stream,10.2307/2425939
1987,American Midland Naturalist,Effect of topographic position and fire on species composition in tallgrass prairie in northeast Kansas,10.2307/2425988
1987,American Naturalist,The distribution and abundance of tallgrass prairie plants: a test of the core-satellite hypothesis,10.1086/284695
1987,American Midland Naturalist,Changes in soluble nutrients of prairie riparian vegetation during decomposition on a floodplain,10.2307/2425704
1988,American Midland Naturalist,Long-distance movements by Reithrodontomys megalotis in tallgrass prairie,10.2307/2425999
1988,Oikos,Community dynamics of prairie grasshoppers subjected to periodic fire: predictable trajectories or random walks in time?,10.2307/3565201
1988,American Midland Naturalist,Hydrologic influences on leaf decomposition in a channel and adjacent bank of a gallery forest stream,10.2307/2425882
1988,Landscape Ecology,"Linking knowledge among spatial and temporal scales: Vegetation, atmosphere, climate and remote sensing",10.1007/BF00138905
1988,Ecology,Causes of fire effects in tallgrass prairie,10.2307/1943159
1988,Ecology,The postfire environment and earthworm populations in tallgrass prairie,10.2307/1940446
1988,Oikos,"Maximization of densities of soil animals by foliage herbivory: empirical evidence, graphical and conceptual models",10.2307/3565649
1989,Ecography,Comparative analysis of temporal and spatial variability in aboveground production in a deciduous forest and prairie,10.1111/j.1600-0587.1989.tb00831.x
1989,Ecology,Interspecific interactions among phytophagous insects of tallgrass prairie: an experimental test,10.2307/1937548
1989,American Midland Naturalist,Effects of animal disturbance on tallgrass prairie vegetation,10.2307/2425665
1989,American Midland Naturalist,Feeding ecology of some earthworms in Kansas tallgrass prairie,10.2307/2425658
1990,Conservation Biology,Lands for long-term research in conservation biology,10.1111/j.1523-1739.1990.tb00292.x
1990,American Naturalist,A hierarchical analysis of species abundance patterns in grassland vegetation,10.1086/285066
1990,Oikos,Patch structure in tallgrass prairies: dynamics of satellite species,10.2307/3565944
1990,American Midland Naturalist,Influence of plant litter on patch use by foraging Peromyscus maniculatus and Reithrodontomys megalotis,10.2307/2426095
1990,Functional Ecology,Influence of plant size on the carbon and water relations of Cucurbita foetidissima HBK,10.2307/2389445
1990,Ecology,Patterns and controls of nitrogen in tallgrass prairie streams,10.2307/1937609
1991,Ecology,Importance of spatial and temporal dynamics in species regional abundance and distribution,10.2307/2937205
1991,Ecology,"Soil, nitrogen, phosphorus, and organic matter processing by earthworms in tallgrass prairie",10.2307/1941562
1991,Ecological Modelling,Stochastic analysis of the dynamics of nitrogen concentration in a stream ecosystem,10.1016/0304-3800(91)90191-3
1991,Ecology,Physiological interactions along resource gradients in a tallgrass prairie,10.2307/2937207
1992,Ecology,Fire frequency and community heterogeneity in tallgrass prairie vegetation,10.2307/1941450
1992,Ecology,Absence of interspecific competition among tallgrass prairie grasshoppers during a drought,10.2307/1940178
1992,Oikos,Effects of scale and disturbance on rates of immigration and extinction of species in prairies,10.2307/3545388
1993,Journal of Vegetation Science,Mechanisms and processes in vegetation dynamics: Introduction,10.1111/j.1654-1103.1993.tb01885.x
1993,Journal of Vegetation Science,The hierarchical continuum concept,10.2307/3236099
1993,Journal of Applied Ecology,Management practices in tallgrass prairie: Large- and small-scale experimental effects on species composition,10.2307/2404626
1993,Journal of Vegetation Science,Experimental analysis of patch dynamics in tallgrass prairie plant communities,10.2307/3236100
1993,Ecology,Denitrification in a tallgrass prairie landscape,10.2307/1940811
1993,Ecological Applications,Biomass production in a tallgrass prairie ecosystem exposed to ambient and elevated CO2,10.2307/1942097
1993,American Naturalist,Consequences of non-equilibrium resource availability across multiple time scales: the transient maxima hypothesis,10.1086/285494
1993,Ecological Applications,"Maximization of aboveground grassland production: the role of defoliation frequency, intensity and history",10.2307/1941800
1994,American Midland Naturalist,Mycorrhizal dependence of Andropogon gerardii and Schizachyrium scoparium in two prairie soils,10.2307/2426592
1994,Trends in Ecology and Evolution,Experimental manipulation of natural plant communities,10.1016/0169-5347(94)90203-8
1994,Ecology,Drought-induced nitrogen retranslocation in perennial C4 grasses of tallgrass prairie,10.2307/1941592
1995,Landscape Ecology,Landscape-level interactions between topoedaphic features and nitrogen limitation in tallgrass prairie,10.1007/BF00130211
1995,Trends in Ecology &amp; Evolution,The measurement of stability in grasslands,10.1016/S0169-5347(00)88998-3
1995,Ecology,Experimental analysis of intermediate disturbance and initial floristic composition: decoupling cause and effect,10.2307/1941207
1995,Ecological Modelling,Simulation of responses of community structure to species interactions driven by phenotypic change,10.1016/0304-3800(94)00030-L
1995,Ecological Modelling,Spatial model error analysis using autocorrelation indices,10.1016/0304-3800(94)00074-R
1995,American Midland Naturalist,Use of simulated herbaceous canopy by foraging rodents,10.2307/2426395
1995,American Midland Naturalist,Temporal variation in abundance of Peromyscus leucopus in wooded habitats of eastern Kansas,10.2307/2426343
1995,Journal of Biogeography,Regional climatic similarities in the temperate zones of North and South America,
1995,Ecology,Effects of urine deposition on small-scale patch structure in prairie vegetation,10.2307/1940926
1995,Ecography,"Elemental analysis of mineral lick soils from the Serengeti National Park, the Konza Prairie and Yellowstone National Park",10.1111/j.1600-0587.1995.tb00122.x
1996,Ecological Modelling,The effect of density dependence on community structure,10.1016/0304-3800(95)00209-X
1996,Freshwater Biology,"The ecology of a subterranean isopod, Caecidotea tridentata",10.1046/j.1365-2427.1996.00497.x
1996,Ecology,Plant tolerance of gall-insect attack and gall-insect performance,10.2307/2265627
1996,Functional Ecology,Retranslocation of shoot nitrogen to rhizomes and roots in prairie grasses may limit loss of N to grazing and fire during drought,10.2307/2390289
1996,Conservation Biology,Interference competition from House wrens as a factor in the decline of Bewick's wrens,10.1046/j.1523-1739.1996.10010281.x
1996,Landscape Ecology,"Forest spread and phase transitions at forest-prairie ecotones in Kansas, U.S.A",10.1007/BF02071813
1996,Oikos,Trophic interactions and plant species richness along a productivity gradient,10.2307/3546357
1997,New Zealand Journal of Ecology,Spatiotemporal scales of non-equilibrium community dynamics: a methodological challenge,
1997,Ecology,"Fire, N availability and plant response in grasslands: A test of the transient maxima hypothesis",10.1890/0012-9658(1997)078[2359:FNAAPR]2.0.CO;2
1997,Ecological Applications,Effects of organismal and distance scaling on analysis of species distribution and abundance,10.1890/1051-0761(1997)007[0543:EOOADS]2.0.CO;2
1997,Oikos,"Interspecific interactions: constructing a general, neutral model for interaction type",10.2307/3546305
1997,Oikos,"Gradient models, gradient analysis and hierarchical structure in plant communities",10.2307/3545796
1997,Southwestern Naturalist,A case of senescence for the white-footed mouse?,
1997,Microbial Ecology,Influence of protozoa and nutrient availability on nitrification rates in subsurface sediments,10.1007/s002489900045
1997,Ecology,"Soil N and plant responses to fire, topography and supplemental N in tallgrass prairie",10.1890/0012-9658(1997)078[1832:SNAPRT]2.0.CO;2
1997,Ecological Applications,Detecting fire and grazing patterns in tallgrass prairie using spectral mixture analysis,10.1890/1051-0761(1997)007[0493:DFAGPI]2.0.CO;2
1999,Pedobiologia,Influence of differing land management on the invasion of North American tallgrass prairie soils by European earthworms,
1999,Acta Oecologica,Does a tradeoff exist between morphological and physiological root plasticity? A comparison of grass growth forms,10.1016/S1146-609X(00)86619-9
1999,American Midland Naturalist,The effects of bison crossings on the macroinvertebrate community in a tallgrass prairie stream,10.1674/0003-0031(1999)141[0253:TEOBCO]2.0.CO;2
1999,Journal of Ecology,Designs for greenhouse studies of interactions between plants,10.1046/j.1365-2745.1999.00321.x
1999,Journal of Ecology,"The core-satellite species hypothesis provides a theoretical basis for Grimes classification of dominant subordinate, and transient species",10.1046/j.1365-2745.1999.00424.x
1999,Ecology,Mycorrhizae influence plant community structure and diversity in tallgrass prairie,10.1890/0012-9658(1999)080[1187:MIPCSA]2.0.CO;2
1999,Global Change Biology,Biomass production and species composition change in a tallgrass prairie ecosystem after long-term exposure to elevated atmospheric CO2,10.1046/j.1365-2486.1999.00245.x
1999,American Midland Naturalist,"Effects of fire, browsers, and gallers on New Jersey Tea (Ceanothus herbaceous) growth and reproduction",10.1674/0003-0031(1999)141[0051:EOFBAG]2.0.CO;2
1999,Southwestern Naturalist,Bison performance and productivity on tallgrass prairie,
2000,American Naturalist,Disturbance frequency and community stability in native tallgrass prairie,10.1086/303326
2000,Ecosystems,Quantification of the nitrogen cycle in a prairie stream,10.1007/s100210000050
2000,Ecosystems,Altering rainfall timing and quantity in a mesic grassland ecosystem: Design and performance of rainfall manipulation shelters,10.1007/s100210000028
2000,American Midland Naturalist,Wallowing behavior of American bison (Bos bison) in tallgrass prairie: an examination of alternate explanations,10.1674/0003-0031(2000)144[0159:WBOABB]2.0.CO;2
2001,Ecology Letters,Habitat patchiness and plant species richness,10.1046/j.1461-0248.2001.00242.x
2001,Plant Ecology,Determinants of C3 forb growth and production in a C4 dominated grassland,10.1023/A:1011400101014
2001,Journal of Vegetation Science,Carbon and water relations of juvenile Quercus species in tallgrass prairie,10.2307/3236868
2001,Ecology,Fire and grazing regulate belowground processes in tallgrass prairie,10.1890/0012-9658(2001)082[3377:FAGRBP]2.0.CO;2
2001,Ecosystems,Frequency and extent of water limitation to primary production in a mesic temperate grassland,10.1007/s100210000057
2001,American Midland Naturalist,Influence of grazing by bison and cattle on deer mice in burned tallgrass prairie,10.1674/0003-0031(2001)146[0361:IOGBBA]2.0.CO;2
2001,American Midland Naturalist,Responses of the co-dominant grassland species Andropogon gerardii and Sorghastrum nutans to long-term manipulations of nitrogen and water,10.1674/0003-0031(2001)145[0159:ROTCGS]2.0.CO;2
2001,Ecology,Feedback loops in ecological hierarchies following urine deposition in tallgrass prairie,10.1890/0012-9658(2001)082[1319:FLIEHF]2.0.CO;2
2002,Ecological Applications,Changes in ecosystem structure and function along a chronosequence of restored grasslands,10.1890/1051-0761(2002)012[1688:CIESAF]2.0.CO;2
2002,Journal of Vegetation Science,Influence of climate variability on plant production and N-mineralization in Central US grasslands,10.1111/j.1654-1103.2002.tb02062.x
2002,Oikos,Effect of local and regional processes on plant species richness in tallgrass prairie,10.1034/j.1600-0706.2002.12112.x
2002,Microbial Ecology,A cross-system comparison of bacterial and fungal biomass in detritus pools of headwater streams,10.1007/s00248-001-1020-x
2002,American Midland Naturalist,"Clone size of Andropogon gerardii Vitman (Big Bluestem) at Konza Prairie, Kansas",10.1674/0003-0031(2002)147[0295:CSOAGV]2.0.CO;2
2002,Ecological Applications,Comparisons of nitrification and denitrification in prairie and agriculturally influenced streams,10.1890/1051-0761(2002)012[0998:CONADI]2.0.CO;2
2002,Diversity and Distributions,Biogeographic variation in nest placement: a case study with conservation implications,10.1046/j.1366-9516.2001.00126.x
2002,Plant Ecology,Long-term responses of the grassland co-dominants Andropogon gerardii and Sorghastrum nutans to changes in climate and management,10.1023/A:1020320214750
2003,Plant Ecology,Spatial heterogeneity in the herbaceous layer of a semi-arid savanna ecosystem,10.1023/A:1023927512590
2003,Ecology,Soil resources regulate productivity and diversity in newly established tallgrass prairie,10.1890/0012-9658(2003)084[0724:SRRPAD]2.0.CO;2
2003,Conservation Biology,Invasion of exotic plant species in tallgrass prairie fragments,10.1046/j.1523-1739.2003.02107.x
2003,American Midland Naturalist,Use of bison wallows by anurans on Konza Prairie,10.1674/0003-0031(2003)150[0158:UOBWBA]2.0.CO;2
2003,Journal of Vegetation Science,Consequences of shrub expansion in mesic grassland: resource alterations and graminoid responses,10.1111/j.1654-1103.2003.tb02175.x
2003,Ecological Monographs,"Relationships at the aboveground-belowground interface: Plants, soil biota, and soil processes",10.1890/0012-9615(2003)073[0377:RATAIP]2.0.CO;2
2003,Natural Areas Journal,"Effects of burning on snakes in Kansas, USA, tallgrass prairie",
2003,Ecology Letters,Dominant species maintain ecosystem function with non-random species loss,10.1046/j.1461-0248.2003.00454.x
2003,Global Change Biology,A cross-biome comparison of daily light use efficiency for gross primary production,10.1046/j.1365-2486.2003.00573.x
2004,Oecologia,Plant community responses to resource availability and heterogeneity during restoration,10.1007/s00442-004-1541-3
2004,Functional Ecology,Competitive relationships of Andropogon gerardii (big bluestem) from remnant and restored native populations and select cultivated varieties,10.1111/j.0269-8463.2004.00850.x
2004,African Journal of Ecology,Fire effects on mycorrhizal symbiosis and root system architecture in southern African savanna grasses,10.1111/j.1365-2028.2004.00533.x
2004,Ecology,Direct and indirect effects of fire on shrub density and aboveground productivity in a mesic grassland,10.1890/03-0574
2004,Ecological Applications,Needed: A unified infrastructure to support long-term scientific research on public lands,10.1890/03-5106
2004,Southwestern Naturalist,Predation by gray catbird on brown thrasher eggs,10.1894/0038-4909(2004)049<0101:PBGCOB>2.0.CO;2
2004,Ecology,Vegetation-mediated changes in microclimate reduce soil respiration as woodlands expand into grasslands,10.1890/03-0576
2005,Ecology,Evidence for a general species-time-area relationship,10.1890/05-0067
2005,Oecologia,"Competition, facilitation, and niche differentiation in two foliar pathogens",10.1007/s00442-004-1814-x
2005,Landscape Ecology,"Taxon-dependent scaling: beetles, birds, and vegetation at four North American grassland sites",10.1007/s10980-004-5651-4
2005,Ecology,Environmental constraints on a global relationship among leaf and root traits of grasses,10.1890/04-1075
2005,Ecology,Partitioning of nitrogen over five growing seasons in tallgrass prairie,10.1890/03-0790
2005,American Midland Naturalist,Woody plant encroachment and removal in mesic grassland: production and composition responses of herbaceous vegetation,10.1674/0003-0031(2005)153[0217:WPEARI]2.0.CO;2
2005,Ecosystems,Regional patterns in carbon cycling across the Great Plains of North America,10.1007/s10021-004-0117-8
2005,Ecological Applications,A test for community change using a null model approach,10.1890/04-1490
2006,Plant Ecology,The role of seed and vegetative reproduction in plant recruitment and demography in tallgrass prairie,10.1007/s11258-005-0975-y
2006,Aquatic Ecology,Temperature and kairomone induced life history plasticity in coexisting Daphnia,10.1007/s10452-006-9035-5
2006,Freshwater Biology,Effects of floods on fish assemblages in an intermittent prairie stream,10.1111/j.1365-2427.2006.01640.x
2006,African Journal of Ecology,Bud banks of perennial savanna grasses in Botswana,10.1111/j.1365-2028.2006.00646.x
2006,Ecology,Does plant species co-occurrence influence soil mite diversity?,10.1890/05-0380
2006,Ecology,Are soil mite assemblages structured by the identity of native and invasive alien grasses?,10.1890/0012-9658(2006)87[1314:ASMASB]2.0.CO;2
2006,Molecular Ecology,Molecular approach for assessing responses of microbial-feeding nematodes to burning and chronic nitrogen enrichment in a native grassland,10.1111/j.1365-294X.2006.02971.x
2006,Journal of Wildlife Management,Estimation of demographic parameters from liveencounter data: a summary review,10.2193/0022-541X(2006)70[1504:EODPFL]2.0.CO;2
2006,Functional Ecology,Mycorrhizal-mediated phosphorus transfer between tallgrass prairie plants Sorghastrum nutans and Artemisia ludoviciana,10.1111/j.1365-2435.2006.01134.x
2007,Trends in Ecology and Evolution,"Trophic state, eutrophication, and nutrient criteria in streams",10.1016/j.tree.2007.07.010
2007,Oecologia,Stream insect occupancy-frequency patterns and metapopulation structure,10.1007/s00442-006-0596-8
2007,Oecologia,Linking water uptake with rooting patterns in grassland species,10.1007/s00442-007-0745-8
2007,Oikos,Soil water partitioning contributes to species coexistence in tallgrass prairie,10.1111/j.0030-1299.2007.15630.x
2007,American Midland Naturalist,Altered ecosystem nitrogen dynamics as a consequence of land cover change in tallgrass prairie,10.1674/0003-0031(2007)158[432:AENDAA]2.0.CO;2
2007,Behavioral Ecology,"Nest mate size, but not short-term need, influences begging behavior of a generalist brood parasite",10.1093/beheco/arl068
2007,Journal of Ecology,Intra-seasonal precipitation patterns and aboveground productivity in three perennial grasslands,10.1111/j.1365-2745.2007.01237.x
2007,Southwestern Naturalist,Spatial variation in predation attempts on artificial snakes in a fire-disturbed tallgrass prairie,10.1894/0038-4909(2007)52[263:SVIPAO]2.0.CO;2
2008,Ecology,Grassland establishment under varying resource availability: A test of positive and negative feedback,10.1890/07-0417.1
2008,Global Change Biology,Changes in grassland ecosystem function due to extreme rainfall events: implications for responses to climate change,10.1111/j.1365-2486.2008.01605.x
2008,Global Change Biology,Modelled effects of precipitation on ecosystem carbon and water dynamics in different climatic zones,10.1111/j.1365-2486.2008.01651.x
2008,Plant Ecology,Comparison of damage to native and exotic tallgrass prairie plants by natural enemies,10.1007/s11258-008-9395-0
2008,Ecography,Temporal coherence of aboveground net primary productivity in mesic grasslands,10.1111/j.0906-7590.2008.05351.x
2008,Restoration Ecology,Integrating soil ecological knowledge into restoration management,10.1111/j.1526-100X.2008.00477.x
2008,Ecological Applications,Cowbird removals unexpectedly increase productivity of a brood parasite and the songbird host,10.1890/07-0984.1
2008,American Midland Naturalist,Influence of woody vegetation on small mammals in tallgrass prairie,10.1674/0003-0031(2008)160[7:IOWVOS]2.0.CO;2
2008,Ecosystems,Woody plant encroachment by Juniperus virginiana in a mesic native grassland promotes rapid carbon and nitrogen accrual,10.1007/s10021-008-9133-4
2008,Behavioral Ecology and Sociobiology,Phenotypic correlates and survival consequences of male mating success in lek-mating Greater Prairie-chickens (Tympanuchus cupido),10.1007/s00265-008-0566-8
2008,Freshwater Biology,Ammonium uptake and mineralization in prairie streams: chamber incubation and short-term nutrient addition experiments,10.1111/j.1365-2427.2007.01870.x
2008,Rangeland Ecology and Management,Long-term response patterns of tallgrass prairie to frequent summer burning,10.2111/08-043.1
