YEAR,JOURNAL,TITLE,DOI
2009,Ecohydrology,Ecohydrology of dry regions of the United States: precipitation pulses and intra-seasonal drought,10.1002/eco.53
2009,Ecosystems,Estimating root production: comparison of 11 methods in shortgrass steppe and review of biases,10.1007/s10021-009-9295-8
2009,Journal of Animal Ecology,Evidence for the involvement of an alternate rodent host in the dynamics of introduced plague in prairie dogs,10.1111/j.1365-2656.2009.01541.x
2009,Journal of Applied Ecology,Introduced plague lessens the effects of an herbivorous rodent on grassland vegetation,10.1111/j.1365-2664.2009.01660.x
2009,Rangeland Ecology and Management,Livestock as ecosystem engineers for grassland bird habitat in the western Great Plains of North America,10.2111/08-008.1
2009,Rangeland Ecology and Management,Plant Interspaces Resulting From Contrasting Grazing Management in Northern Mixed-Grass Prairie: Implications for Ecosystem Function,10.2111/08-098
2009,Journal of Vegetation Science,Plant population and community responses to removal of dominant species in the shortgrass steppe,10.1111/j.1654-1103.2009.05556.x
2009,Rangeland Ecology and Management,Vegetation responses to prescribed burning of grazed shortgrass steppe,10.2111/08-135
2009,Oecologia,Wetting and drying cycles drive variations in the stable carbon isotope ratio of respired carbon dioxide in semi-arid grassland,10.1007/s00442-009-1302-4
2008,Ecology,"Global potential net primary production predicted from vegetation class, precipitation, and temperature",10.1890/07-0850.1
2008,Oecologia,Increasing precipitation event size increases aboveground net primary productivity in a semi-arid grassland.,10.1007/s00442-008-1116-9
2008,Global Change Biology,Infra-red heater arrays for warming ecosystem field plots,10.1111/j.1365-2486.2007.01486.x
2008,Oecologia,Interactive disturbance effects of two disparate ecosystem engineers in North American shortgrass steppe,10.1007/s00442-008-1068-0
2008,Ecology Letters,A landscape theory for food web architecture,10.1111/j.1461-0248.2008.01193.x
2008,Ecology,Resources from another place and time: Responses to pulses in a spatially subsidized system,10.1890/07-0234.1
2008,Global Change Biology,Sensitivity of organic matter decomposition to warming varies with its quality,10.1111/j.1365-2486.2008.01541.x
2007,Ecological Research,Appropriate discounting leads to forward-looking ecosystem management,10.1007/s11284-006-0072-2
2007,Rangeland Ecology and Management,Blackland tallgrass prairie vegetation dynamics following cessation of herbicide application,10.2111/05-097R4.1
2007,Journal of Soil and Water Conservation,Carbon sequestration and rangelands: a synthesis of land management and precipitation effects,
2007,Ecology Letters,Diversity-stability relationship varies with latitude in zooplankton,10.1111/j.1461-0248.2006.01009.x
2007,Oikos,Global patterns of aquatic food chain length,10.1111/j.0030-1299.2007.16036.x
2007,Frontiers in Ecology and the Environment,A grassroots approach to sensor and science networks,10.1890/1540-9295(2007)5[343:AGATSA]2.0.CO;2
2007,Rangeland Ecology and Management,Grazing-induced modifications to peak standing crop in northern mixed-grass prairie,10.2111/1551-5028(2007)60[270:GMTPSC]2.0.CO;2
2007,Freshwater Biology,Intensive trapping and increased fish predation cause massive population decline of an invasive crayfish,10.1111/j.1365-2427.2007.01741.x
2007,Ecological Applications,Life-Cycle Assessment of Net Greenhouse-Gas Flux for Bioenergy Cropping Systems,10.1890/05-2018
2007,Ecological Modelling,Linking terrestrial and aquatic ecosystems: the role of woody habitat in lake food webs,10.1016/j.ecolmodel.2006.12.005
2007,Western North American Naturalist,Livestock and vegetation responses to rotational grazing in short-grass steppe,10.3398/1527-0904(2007)67[359:LAVRTR]2.0.CO;2
2007,Global Change Biology,Plant trait responses to grazing - a global synthesis,10.1111/j.1365-2486.2006.01288.x
2007,Rangeland Ecology and Management,The potential for horses to disperse alien plants along recreational trails,10.2111/06-102R1.1
2007,Ecosystems,"Reciprocal relationships between exotic rusty crayfish, macrophytes and Lepomis  species in northern Wisconsin lakes",10.1007/s10021-006-9004-9
2007,Ecology Letters,Separating the determinants of phylogenetic community structure,10.1111/j.1461-0248.2007.01083.x
2007,Freshwater Biology,Small lakes dominate a random sample of regional lake characteristics,10.1111/j.1365-2427.2007.01730.x
2007,ISME Journal,Synchrony in aquatic microbial community dynamics,10.1038/ismej.2007.6
2006,Ecology,Adding infection to injury: synergistic effects of predation and parasitism on amphibian malformations,10.1890/0012-9658(2006)87[2227:AITISE]2.0.CO;2
2006,Frontiers in Ecology and the Environment,Are livestock weight gains affected by black-tailed prairie dogs?,10.1890/1540-9295(2006)4[459:ALWGAB]2.0.CO;2
2006,Freshwater Biology,"Chytrid infections of Daphnia pulicaria : development, ecology, pathology, and phylogeny of Polycaryum laeve",10.1111/j.1365-2427.2006.01517.x
2006,Journal of Vegetation Science,"Controls over invasion of Bromus tectorum: The importance of climate, soil, disturbance, and seed availability",10.1658/1100-9233(2006)17[693:COIOBT]2.0.CO;2
2006,Ecology,Detection of scale-specific community dynamics using wavelets,10.1890/0012-9658(2006)87[2895:DOSCDU]2.0.CO;2
2006,Ecology,Dining on disease : How interactions between infection and environment affect predation risk,10.1890/0012-9658(2006)87[1973:DODHIB]2.0.CO;2
2006,Journal of Arid Environments,"Do abiotic differences explain contrasting graminoid functional traits in sagebrush steppe, USA and Patagonian steppe, Argentina",10.1016/j.jaridenv.2005.07.003
2006,Oikos,Early-successional plants regulate grassland productivity and species composition: a removal experiment,10.1111/j.2006.0030-1299.14267.x
2006,Trends in Ecology and Evolution,Ecology for transformation,10.1016/j.tree.2006.02.007
2006,Ecological Complexity,The epistemological predicament associated with purposive quantitative analysis,10.1016/j.ecocom.2007.02.005
2006,Ecological Modelling,Exploring ecological patterns with structural equation modeling and Bayesian analysis,10.1016/j.ecolmodel.2005.07.028
2006,Frontiers in Ecology and the Environment,Extreme climatic events shape arid and semiarid ecosystems,10.1890/1540-9295(2006)004[0087:ECESAA]2.0.CO;2
2006,Conservation Biology,Forecasting the spread of invasive rainbow smelt in the Laurentian Great Lakes region of North America,10.1111/j.1523-1739.2006.00508.x
2006,Ecology and Society,A handful of heuristics and some propositions for understanding resilience in social-ecological systems,10.5751/ES-01530-110113
2006,Ecological Monographs,Lake dissolved inorganic carbon and dissolved oxygen: changing drivers from days to decades,10.1177/0888325406287176
2006,Western North American Naturalist,Long-term effects of tebuthiuron on Bromus tectorum,10.3398/1527-0904(2006)66[420:LEOTOB]2.0.CO;2
2006,Journal of Soil and Water Conservation,Monitoring and predicting manure application rates using precision conservation technology,
2006,Journal of Ecology,Natural and anthropogenic variation in coarse wood among and within lakes,10.1111/j.1365-2745.2006.01117.x
2006,Ecological Complexity,The nature of ecological complexity: A protocol for building the narrative.,10.1016/j.ecocom.2006.06.002
2006,Biological Invasions,The rapid spread of rusty crayfish (Orconectes rusticus) with observations on native crayfish declines in Wisconsin (U.S.A.) over the past 130 years,10.1007/s10530-005-7854-2
2006,Ecology Letters,Rising variance: a leading indicator of ecological transition,10.1111/j.1461-0248.2005.00877.x
2006,Ecology and Society,Shooting the rapids: navigating transitions to adaptive governance of social-ecological systems,10.5751/ES-01595-110118
2006,Journal of Soil and Water Conservation,"Soil carbon pools in central Texas: prairies, restored grasslands and croplands",
2006,Rangeland Ecology and Management,Strategic and tactical prediction of forage production in northern mixed-grass prairie,10.2111/06-001R1.1
2006,Environmental Biology of Fishes,Timing and site selection of spawning in a landlocked population of rainbow smelt in Wisconsin,10.1007/s10641-006-9005-8
2006,Ecological Applications,Trajectories of zooplankton recovery in the Little Rock Lake whole-lake acidification experiment,10.1890/04-1800
2006,Ecosystems,Uncertainty in calculations of net primary production for grasslands,10.1007/s10021-005-0072-z
2006,Rangeland Ecology and Management,Vegetation on Gunnison's prairie dog colonies in southwestern Colorado,10.2111/1551-5028(2006)59[073:VOGPDC]2.0.CO;2
2006,Ecology and Society,"Water RATs (Resilience, Adaptability, and Transformability) in lake and wetland social-ecological systems",10.5751/ES-01556-110116
2005,Environmental Biology of Fishes,Arthur D. Hasler: he showed us the way,10.1007/s10641-005-3986-6
2005,Global Change Biology,"Carbon fluxes, nitrogen cycling, and soil microbial communities in adjacent urban, native and agricultural ecosystems",10.1111/j.1365-2486.2005.00921.x
2005,Ecology,"Eutrophication due to phosphorus recycling in relation to lake morphometry, temperature, and macrophytes.",10.1890/03-0545
2005,Rangeland Ecology and Management,Evaluation of GPFARM for simulation of forage production and cow-calf weights,10.2111/1551-5028(2005)58[247:EOGFSO]2.0.CO;2
2005,Rangeland Ecology and Management,Heifer performance under two stocking rates on fourwing saltbush-dominated rangeland,10.2111/1551-5028(2005)58[489:HPUTSR]2.0.CO;2
2005,Ecology,The impact of cropping on primary production in the U.S. Great Plains,10.1890/04-0493
2005,Ecology,"Land use, primary productivity, and lake area as descriptors of zooplankton diversity.",10.1890/03-0833
2005,Ecological Applications,"Land use, water chemistry, aquatic vegetation and zooplankton community structure of shallow lakes",10.1890/04-1494
2005,Ecology,"Landscape ecology in North America: past, present and future",10.1890/04-0890
2005,Ecological Applications,Plant traits and ecosystem grazing effects: Comparison of U.S. sagebrush steppe and Patagonian steppe,10.1890/04-0231
2005,Proceedings of the Royal Society B: Biological Sciences,Population effects of increased climate variation,10.1098/rspb.2005.3148
2005,Landscape Ecology,"Potential corridors for the rusty crayfish, Orconectes rusticus, in Northern Wisconsin (USA) lakes: lessons for exotic invasions",10.1007/s10980-004-5649-y
2005,Ecosystems,Surrogates for resilience of social-ecological systems,10.1007/s10021-005-0170-y
2005,Ecology and Society,Uncertainty in discount models and environmental accounting,10.5751/ES-01586-100213
2004,Microbial Ecology,Annual patterns in bacterioplankton community variability in a humic lake,10.1007/s00248-004-0244-y
2004,Landscape and Urban Planning,Characterizing dynamic spatial and temporal residential density patterns from 1940-1990 across the North Central United States,10.1016/j.landurbplan.2003.08.011
2004,Journal of Arid Environments,Ecological impact of historical and future land-use patterns in Senegal,10.1016/j.jaridenv.2004.03.024
2004,Ecology Letters,Effects of environmental variation on extinction and establishment,10.1046/j.1461-0248.2003.00546.x
2004,Global Change Biology,Effects of nitrogen deposition and insect herbivory on patterns of ecosystem-level carbon and nitrogen dynamics: Results from the CENTURY model,10.1111/j.1529-8817.2003.00791.x
2004,Journal of Applied Ecology,Functional traits of graminoids in semi-arid steppes: a test of grazing histories.,10.1111/j.0021-8901.2004.00934.x
2004,Microbial Ecology,Genetically distinct populations of the dinoflagellate Peridinium limbatum in neighboring Northern Wisconsin lakes.,10.1007/s00248-004-0219-z
2004,Journal of Soil and Water Conservation,The human dimension of resource management programs,
2004,Journal of Soil and Water Conservation,Manure management in urbanizing settings,
2004,Ecological Applications,Methane and nitrous oxide fluxes from urban soils to the atmosphere.,10.1890/03-5115
2004,Global Change Biology,A model of carbon evasion and sedimentation in temperate lakes.,10.1111/j.1529-8817.2003.00805.x
2004,American Midland Naturalist,"Mound microclimate, nutrients and seedling survival.",10.1674/0003-0031(2004)152[0012:MMNASS]2.0.CO;2
2004,Oecologia,A multi-scale perspective of water pulses in dryland ecosystems: climatology and ecohydrology of the western USA,10.1007/s00442-004-1570-y
2004,Ecosystems,Plant nitrogen dynamics in shortgrass steppe under elevated atmospheric carbon dioxide,10.1007/s10021-003-0201-5
2004,Ecological Applications,Predicting occurrences and impacts of smallmouth bass introductions in north temperate lakes,
2004,Ecology and Society,"Resilience, adaptability and transformability in social-ecological systems.",10.5751/ES-00650-090205
2004,Ecology and Society,"Spatial complexity, resilience, and policy diversity: fishing on lake-rich landscapes.",10.5751/ES-00622-090108
2004,Ecological Applications,A test of the Environmental Kuznets Curve using long-term watershed inputs,10.1890/02-5381
2003,Ecology and Society,"Assessing future ecosystem services: a case study of the Northern Highlands Lake District, Wisconsin",
2003,Trends in Ecology and Evolution,Catastrophic regime shifts in ecosystems: linking theory to observation,10.1016/j.tree.2003.09.002
2003,Ecological Engineering,Distinguishing ecological engineering from environmental engineering,10.1016/j.ecoleng.2003.08.007
2003,Plant Ecology,Effects of nitrogen availability on competition between Bromus tectorum and Bouteloua gracilis,10.1023/A:1023934515420
2003,Plant Ecology,Effects of ungulates and prairie dogs on seed banks and vegetation in a North American mixed-grass prairie.,10.1023/A:1023929627168
2003,Ecological Applications,Grassland to Woodland Transitions: Integrating Changes in Landscape Structure and Biogeochemistry,10.1890/1051-0761(2003)13[911:GTWTIC]2.0.CO;2
2003,Ecological Applications,Land use impacts on the normalized difference vegetation index in temperate Argentina,10.1890/1051-0761(2003)013[0616:LUIOTN]2.0.CO;2
2003,Conservation Biology,Limb deformities as an emerging parasitic disease in amphibians: evidence from museum specimens and resurvey data.,10.1111/j.1523-1739.2003.00217.x
2003,Ecological Applications,Optimal phosphorus loading for a potentially eutrophic lake,10.1890/1051-0761(2003)13[1135:OPLFAP]2.0.CO;2
2003,Ecology and Society,Resource transitions and energy gain: contexts of organization,
2003,Conservation Biology,Scenario planning: a tool for conservation in an uncertain world,10.1046/j.1523-1739.2003.01491.x
2003,Ecology,Uncertainty and the management of multistate ecosystems: an apparently rational route to collapse,10.1890/0012-9658(2003)084[1403:UATMOM]2.0.CO;2
2003,Ecology,"Variability of lakes on the landscape: roles of phosphorus, food webs, and dissolved organic carbon",10.1890/0012-9658(2003)084[1563:VOLOTL]2.0.CO;2
2003,Frontiers in Ecology and the Environment,Why global scenarios need ecology,10.1890/1540-9295(2003)001[0322:WGSNE]2.0.CO;2
2002,Plant Ecology,Associations between vegetation patterns and soil texture in the shortgrass steppe,10.1023/A:1015525303754
2002,Oecologia,Bison-prairie dog-plant interactions in a North American mixed-grass prairie.,10.1007/s00442-002-0930-8
2002,Ecosystems,"Comparisons of P-yield, riparian buffer strips, and land cover in six agricultural watersheds",10.1007/s10021-002-0159-8
2002,Oikos,Compensation: an alternative method for analyzing diversity-productivity experiments,10.1034/j.1600-0706.2002.960303.x
2002,Ecosystems,"Contagious disturbance, ecological memory, and the emergence of landscape pattern",10.1007/s10021-001-0077-1
2002,Ecology,Ecosystem ecology at regional scales.,
2002,Ecosystems,Environmental controls of primary production in agricultural systems of the Argentine pampas,
2002,Ecology and Society,Estimating resilience across landscapes,
2002,Oikos,"Grazing refuges, external avoidance of herbivory and plant diversity",10.1034/j.1600-0706.2002.990112.x
2002,Journal of Soil and Water Conservation,Managing soil denitrification,
2002,Wetlands,Modeling carbon accumulation in Rocky Mountain Fens,10.1672/0277-5212(2002)022[0100:MCAIRM]2.0.CO;2
2002,Ecology,Regional patterns of decomposition and primary production rates in the U.S. Great Plains,
2002,Journal of Biogeography,The relative abundance of three plant functional types in temperate grasslands and shrublands of North and South America: Effects of projected climate change.,10.1046/j.1365-2699.2002.00701.x
2002,Ecology and Society,Resilience management in social-ecological systems: a working hypothesis for a participatory approach,
2002,Oikos,The role of a spiny plant refuge in structuring grazed shortgrass steppe plant communities,10.1034/j.1600-0706.2002.980106.x
2002,Ecosystems,Stable nitrogen and carbon pools in grassland soils of variable texture and carbon content,10.1007/s10021-002-0142-4
2002,Freshwater Biology,Stocking piscivores to improve fishing and water clarity: a synthesis of the Lake Mendota biomanipulation project,10.1046/j.1365-2427.2002.01011.x
2002,Global Ecology and Biogeography,Using simple environmental variables to estimate belowground productivity in grasslands.,10.1046/j.1466-822X.2001.00267.x
2001,Ecosystems,Belowground primary production by carbon isotope decay and long-term root biomass dynamics,10.1007/s100210000064
2001,Conservation Biology,Boundaries and corridors as a continuum of ecological flow control: lessons from rivers and streams,10.1046/j.1523-1739.2001.99554.x
2001,Ecological Applications,Compensatory dynamics in zooplankton community responses to acidification: measurement and mechanisms,10.1890/1051-0761(2001)011[1060:CDIZCR]2.0.CO;2
2001,Ecology,Ecological history affects zooplankton community responses to acidification,10.1890/0012-9658(2001)082[2984:EHAZCR]2.0.CO;2
2001,Oecologia,The effect of grazing on the spatial heterogeneity of vegetation,10.1007/s004420100737
2001,Ecological Applications,"Environmental and social factors influencing wildfires in the Upper Midwest, United States",10.1890/1051-0761(2001)011[0111:EASFIW]2.0.CO;2
2001,Ecological Economics,Fairness in the contingent valuation of environmental public goods: attitude toward paying for environmental improvements at two levels of scope,10.1016/S0921-8009(00)00210-X
2001,Ecosystems,From metaphor to measurement: resilience of what to what?,10.1007/s10021-001-0045-9
2001,Journal of Freshwater Ecology,"Manipulation of host density affects infestation of a peritrich ciliate (epistylis lacustris) on a calanoid copepod (leptodiaptomus minutus) in Crystal Lake, Wisconsin, USA",10.1080/02705060.2001.9663847
2001,Ecological Applications,Water in a changing world,10.1890/1051-0761(2001)011[1027:WIACW]2.0.CO;2
2001,Ecology,What is the observed relationship between species richness and productivity?,10.1890/0012-9658(2001)082[2381:WITORB]2.0.CO;2
2001,Wetlands,"Zooplankton communities of restored depressional wetlands in Wisconsin, USA",10.1672/0277-5212(2001)021[0292:ZCORDW]2.0.CO;2
2000,Ecological Applications,Belowground consequences of vegetation change and their treatment in models,10.1890/1051-0761(2000)010[0470:BCOVCA]2.0.CO;2
2000,Freshwater Biology,"Community concordance between the fish and aquatic birds of lakes in northern Alberta, Canada: the relative importance of environmental and biotic factors",10.1046/j.1365-2427.2000.00512.x
2000,Ecology,Compensatory dynamics in planktonic community responses to pH perturbations.,10.1890/0012-9658(2000)081[0387:CDIPCR]2.0.CO;2
2000,Oikos,Defoliation-induced enhancement of total aboveground nitrogen yield of grasses.,10.1034/j.1600-0706.2000.910208.x
2000,Freshwater Biology,Distribution of recreational boating across lakes : do landscape variables affect recreational use?,10.1046/j.1365-2427.2000.00511.x
2000,Ecological Applications,Dynamic simulation of tree-grass interactions for global change studies,10.1890/1051-0761(2000)010[0449:DSOTGI]2.0.CO;2
2000,Microbial Ecology,Effects of resources and trophic interactions on freshwater bacterioplankton diversity,
2000,Journal of Freshwater Ecology,"Evaluation of bacterial recovery efficiency and counting precision from decaying leaf litter in Little Rock Lake, Wisconsin, USA",10.1080/02705060.2000.9663733
2000,Freshwater Biology,Landscape spatial patterns in freshwater snail assemblages across Northern Highland catchments.,10.1046/j.1365-2427.2000.00514.x
2000,Ecosystems,Nutrient cycling in lakes and streams: insights from a comparative analysis,10.1007/s100210000015
2000,Ecosystems,Opening the black boxes: ecosystem science and economic valuation.,10.1007/s100210000001
2000,Ecosystems,Phosphorus flow in a watershed-lake ecosystem,10.1007/s100210000049
2000,Freshwater Biology,Regional coherence of climatic and lake thermal variables of four lake districts in the Upper Great Lakes Region of North America.,10.1046/j.1365-2427.2000.00572.x
2000,Ecology,The relationship in lake communities between primary productivity and species richness,10.1890/0012-9658(2000)081[2662:TRILCB]2.0.CO;2
2000,Freshwater Biology,The relationship of egg size and incubation temperature to embryonic development time in univoltine and multivoltine aquatic insects,10.1046/j.1365-2427.2000.00607.x
2000,Wetlands,Sources and yields of dissolved carbon in northern Wisconsin stream catchments with differing amounts of peatland,10.1672/0277-5212(2000)020[0113:SAYODC]2.0.CO;2
2000,Freshwater Biology,Structuring features of lake districts : landscape controls on lake chemical responses to drought.,10.1046/j.1365-2427.2000.00571.x
2000,Ecology,"Synchronous behavior of temperature, calcium and chlorophyll in lakes of northern Wisconsin.",10.1890/0012-9658(2000)081[0815:SBOTCA]2.0.CO;2
2000,"Agriculture, Ecosystems and Environment",A synthesis of recent global change research on pasture and rangeland production: reduced uncertainties and their management implications.,10.1016/S0167-8809(00)00215-2
2000,Journal of Freshwater Ecology,Using stream macroinvertebrates to compare riparian land use practices on cattle farms in southwestern Wisconsin,10.1080/02705060.2000.9663725
1999,Ecological Applications,Dissolved organic carbon as an indicator of the scale of watershed influence on lakes and rivers.,10.1890/1051-0761(1999)009[1377:DOCAAI]2.0.CO;2
1999,Ecology and Society,Ecological and social dynamics in simple models of ecosystem management,
1999,Ecological Applications,Economic valuation of freshwater ecosystem services in the United States: 1971-1997,10.1890/1051-0761(1999)009[0772:EVOFES]2.0.CO;2
1999,Journal of Vegetation Science,Geographic patterns of simulated establishment of two Bouteloua species: implications for distributions of dominants and ecotones,10.2307/3237063
1999,Ecosystems,Grassland precipitation-use efficiency varies across a resource gradient,10.1007/s100219900058
1999,Ecology,How does habitat patch size affect animal movement?: An experiment with darkling beetles,10.1890/0012-9658(1999)080[2261:HDHPSA]2.0.CO;2
1999,Ecological Applications,Management of eutrophication for lakes subject to potentially irreversible change,10.1890/1051-0761(1999)009[0751:MOEFLS]2.0.CO;2
1999,Ecology and Society,Managing the Resilience of Lakes: A multi-agent modeling approach,
1999,Ecosystems,A phosphorus budget for the Lake Mendota watershed,10.1007/s100219900059
1999,Ecosystems,Response of the shortgrass steppe to changes in rainfall seasonality,10.1007/s100219900065
1999,Southwestern Naturalist,Size and habitat characteristics of home ranges of northern grasshopper mice (Onychomys leucogaster),
1999,Ecosystems,Tips and traps in interdisciplinary research,10.1007/PL00010895
1998,Austral Ecology,Ecological and economic analysis of lake eutrophication by nonpoint pollution,10.1111/j.1442-9993.1998.tb00706.x
1998,Ecological Applications,Functional and structural convergence of temperate grassland and shrubland ecosystems,10.1890/1051-0761(1998)008[0194:FASCOT]2.0.CO;2
1998,Ecological Applications,"Genetics, metapopulations, and ecosystem management of fisheries.",
1998,Ecological Applications,"Integrating cultural, economic, and environmental requirements for fresh water",10.1890/1051-0761(1998)008[0569:ICEAER]2.0.CO;2
1998,Ecological Applications,Linear analysis of soil decomposition: Insights from the century model,10.1890/1051-0761(1998)008[0425:LAOSDI]2.0.CO;2
1998,Oikos,Livestock grazing: Animal and plant biodiversity of shortgrass steppe and the relationship to ecosystem function,10.2307/3546547
1998,Ecological Applications,Long-term environmental monitoring: some perspectives from lakes,10.1890/1051-0761(1998)008[0269:LTEMSP]2.0.CO;2
1998,Ecological Applications,Nonpoint pollution of surface waters with phosphorus and nitrogen,10.1890/1051-0761(1998)008[0559:NPOSWW]2.0.CO;2
1998,Ecosystems,Plant effects on spatial and temporal patterns of nitrogen cycling in shortgrass steppe,10.1007/s100219900031
1998,Conservation Biology,A re-evaluation of the role of prairie dogs in Great Plains grasslands,10.1111/j.1523-1739.1998.97469.x
1998,Plant Ecology,Soil water dynamics and vegetation patterns in a semiarid grassland,10.1023/A:1009769620488
1998,Restoration Ecology,"Zooplankton community responses during recovery from acidification in Little Rock Lake, Wisconsin",10.1046/j.1526-100X.1998.06404.x
1997,Ecology,Effects of temperature and soil texture on ANPP in the US Great Plains,10.1890/0012-9658(1997)078[2628:EOTAST]2.0.CO;2
1997,Ecology,Heterogeneity of soil organic matter following death of individual plants in shortgrass steppe,10.1890/0012-9658(1997)078[1256:HOSOMF]2.0.CO;2
1997,Freshwater Biology,The influence of landscape position on lakes in northern Wisconsin,10.1046/j.1365-2427.1997.00149.x
