YEAR,JOURNAL,TITLE,DOI
2002,Ecological Economics,Introduction to the special issue on the dynamics and value of ecosystem services: integrating economic and ecological perspectives,10.1016/S0921-8009(02)00087-3
2002,Ecological Monographs,"Integrated Ecological Economic Modeling of the Patuxent River Watershed, Maryland",10.1890/0012-9615(2002)072[0203:IEEMOT]2.0.CO;2
2002,Ecological Economics,"A typology for the classification, description and valuation of ecosystem functions, goods and services",10.1016/S0921-8009(02)00089-7
2002,Ecological Economics,Economic and ecological concepts for valuing ecosystem services,10.1016/S0921-8009(02)00088-5
2002,Ecological Economics,"Envisioning shared goals for humanity: a detailed, shared vision of a sustainable and desirable USA in 2100",10.1016/S0921-8009(02)00218-5
2002,Ecological Economics,Complex systems and valuation,10.1016/S0921-8009(02)00090-3
2002,Ecosystems,"The ecosystem as a multidimensional concept: meaning, model and metaphor",10.1007/s10021-001-0051-y
2002,Ecological Modelling,Optimization methodology for land use patterns using spatially explicit landscape models,10.1016/S0304-3800(01)00455-0
2002,Ecological Economics,"Global estimates of market and non-market values derived from nighttime satellite imagery, land cover, and ecosystem service valuation",10.1016/S0921-8009(02)00097-6
2002,Conservation Biology,Zoning Marine Protected Areas through Spatial Multiple‐Criteria Analysis: the Case of the Asinara Island National Marine Reserve of Italy,10.1046/j.1523-1739.2002.00425.x
2002,Ecological Economics,Designing an integrated knowledge base to support ecosystem services valuation,10.1016/S0921-8009(02)00093-9
2002,Ecology and Society,Teaching and learning ecological modeling over the web: a collaborative approach,
2002,Ecological Economics,Discourse-based valuation of ecosystem services: establishing fair outcomes through group deliberation,10.1016/S0921-8009(02)00092-7
2003,Ecological Modelling,Applying the Patuxent Landscape Unit Model to human dominated ecosystems: the case of agriculture,10.1016/S0304-3800(02)00276-4
2003,Frontiers in Ecology and the Environment,Down by the riverside: urban riparian ecology,10.1890/1540-9295(2003)001[0315:DBTRUR]2.0.CO;2
2004,Frontiers in Ecology and the Environment,Carbon cycling in soil,10.1890/1540-9295(2004)002[0522:CCIS]2.0.CO;2
2004,Landscape and Urban Planning,"Resilient cities: meaning, models, and metaphor for integrating the ecological, socio-economic, and planning realms",10.1016/j.landurbplan.2003.10.035
2004,Ecosystems,Integrating Social Science into the Long-Term Ecological Research (LTER) Network: Social Dimensions of Ecological Change and Ecological Dimensions of Social Change,10.1007/s10021-003-0215-z
2005,Landscape Ecology,Placing the pieces: Reconstructing the original property mosaic in a warrant and patent watershed,
2005,"Perspectives in Plant Ecology, Evolution and Systematics",Vegetation change: a reunifying concept in plant ecology,10.1016/j.ppees.2004.11.001
2005,Frontiers in Ecology and the Environment,Designed experiments: new approaches to studying urban ecosystems,10.1890/1540-9295(2005)003[0549:DENATS]2.0.CO;2
2005,Ecology,Statistics of extremes: modeling ecological disturbances,10.1890/04-0606
2005,Ecology and Society,The Effects of Human Socioeconomic Status and Cultural Characteristics on Urban Patterns of Biodiversity,10.5751/ES-01264-100123
2005,Ecosystems,Biocomplexity in Coupled Natural–Human Systems: A Multidimensional Framework,10.1007/s10021-004-0098-7
2005,Ecology and Society,Open Source and Open Content: a Framework for Global Collaboration in Social-Ecological Research,10.5751/ES-01287-100133
2006,Ecological Complexity,"Dimensions of ecosystem complexity: Heterogeneity, connectivity, and history",10.1016/j.ecocom.2005.07.002
2006,Ecosystems,Ecological Thresholds: The Key to Successful Environmental Management or an Important Concept with No Practical Application?,10.1007/s10021-003-0142-z
2006,Ecosystems,Characterization of Households and its Implications for the Vegetation of Urban Ecosystems,10.1007/s10021-006-0116-z
2006,Ecology and Society,From LTER to LTSER: Conceptualizing the Socioeconomic Dimension of Long-term Socioecological Research,10.5751/ES-01786-110213
2006,Ecological Applications,Land Use Change And Nitrogen Enrichment Of A Rocky Mountain Watershed,10.1890/05-0134
2006,Trends in Ecology and Evolution,A distinct urban biogeochemistry?,10.1016/j.tree.2005.12.006
2006,Ecological Economics,"The contribution of built, human, social and natural capital to quality of life in intentional and unintentional communities",10.1016/j.ecolecon.2005.09.021
2006,Global Change Biology,Urban ecosystems and the North American carbon cycle,10.1111/j.1365-2486.2006.01242.x
2006,Ecosystems,Does Anthropogenic Nitrogen Enrichment Increase Organic Nitrogen Concentrations in Runoff from Forested and Human-dominated Watersheds?,10.1007/s10021-006-0076-3
2006,Austral Ecology,"Advancing urban ecological studies: Frameworks, concepts, and results from the Baltimore Ecosystem Study",10.1111/j.1442-9993.2006.01586.x
2007,Frontiers in Ecology and the Environment,Spatial heterogeneity in urban ecosystems: reconceptualizing land cover and a framework for classification,10.1890/1540-9295(2007)5[80:SHIUER]2.0.CO;2
2007,Ecological Economics,Biodiversity and ecosystem services: A multi-scale empirical study of the relationship between species richness and net primary production,10.1016/j.ecolecon.2006.03.021
2007,Frontiers in Ecology and the Environment,Communicating science on Capitol Hill: a case for embedded ecologists,10.1890/1540-9295(2007)5[104:CSOCHA]2.0.CO;2
2008,Biological Conservation,Ecosystem services: Multiple classification systems are needed,10.1016/j.biocon.2007.12.020
2008,Frontiers in Ecology and the Environment,Stream restoration strategies for reducing river nitrogen loads,10.1890/070080
2008,Frontiers in Ecology and the Environment,Putting people in the map: anthropogenic biomes of the world,10.1890/070062
2008,Frontiers in Ecology and the Environment,Disappearing headwaters: patterns of stream burial due to urbanization,10.1890/070101
2008,Ecological Applications,Effects of stream restoration on denitrification in an urbanizing watershed,10.1890/07-1159.1
2008,Ecological Informatics,A user-centered design for a spatial data warehouse for data exploration in environmental research,10.1016/j.ecoinf.2008.08.002
2008,Urban Ecosystems,"Gray squirrel density, habitat suitability, and behavior in urban parks",10.1007/s11252-008-0060-0
2008,Landscape Ecology,Response of forest soil properties to urbanization gradients in three metropolitan areas,10.1007/s10980-008-9288-6
2008,Ecological Applications,Nitrogen retention in urban lawns and forests,10.1890/07-1062.1
2008,Ecoscience,The role of native riparian tree species in decomposition of invasive tree of heaven (Ailanthus altissima) leaf litter in an urban stream,10.2980/1195-6860(2008)15[27:TRONRT]2.0.CO;2
2008,Landscape and Urban Planning,"Property values, parks, and crime: A hedonic analysis in Baltimore, MD",10.1016/j.landurbplan.2008.06.005
2008,Biological Conservation,Plants of a feather: Spatial autocorrelation of gardening practices in suburban neighborhoods,10.1016/j.biocon.2007.10.005
2009,Ecology and Society,Altered Ecological Flows Blur Boundaries in Urbanizing Watersheds,10.5751/ES-02989-140210
2009,Urban Ecosystems,"Altered resources, disturbance, and heterogeneity: A framework for comparing urban and non-urban soils",10.1007/s11252-008-0047-x
2009,Urban Ecosystems,Urban ecosystems: what would Tansley do?,10.1007/s11252-008-0079-2
2009,Urban Ecosystems,A comparison of soil organic carbon stocks between residential turf grass and native soil,10.1007/s11252-008-0059-6
2010,Urban Ecosystems,"Landscape, vegetation characteristics, and group identity in an urban and suburban watershed: why the 60s matter",10.1007/s11252-009-0118-7
2010,Trends in Ecology and Evolution,Ecosystem stewardship: sustainability strategies for a rapidly changing planet,10.1016/j.tree.2009.10.008
2010,Ecological Engineering,Opportunities and challenges for managing nitrogen in urban stormwater: A review and synthesis,10.1016/j.ecoleng.2010.03.015
2010,Global Ecology and Biogeography,"Anthropogenic transformation of the biomes, 1700 to 2000",10.1111/j.1466-8238.2010.00540.x
2010,Restoration Ecology,"Denitrification Potential, Root Biomass, and Organic Matter in Degraded and Restored Urban Riparian Zones",10.1111/j.1526-100X.2008.00438.x
2010,Frontiers in Ecology and the Environment,Rising stream and river temperatures in the United States,10.1890/090037
2010,Frontiers in Ecology and the Environment,The role of interface organizations in science communication and understanding,10.1890/090145
2010,Frontiers in Ecology and the Environment,Communicating with the public: opportunities and rewards for individual ecologists,10.1890/090168
2010,Landscape Ecology,Mapping urban landscape heterogeneity: agreement between visual interpretation and digital classification approaches,10.1007/s10980-009-9427-8
2011,Wetlands,Road Salt Stress Induces Novel Food Web Structure and Interactions,10.1007/s13157-011-0199-y
2011,Urban Ecosystems,Salinization alters ecosystem structure in urban stormwater detention ponds,10.1007/s11252-011-0180-9
2011,Landscape and Ecological Engineering,Urban biodiversity and the importance of management and conservation,10.1007/s11355-010-0146-8
2011,Frontiers in Ecology and the Environment,"Coupling biogeochemical cycles in urban environments: ecosystem services, green solutions, and misconceptions",10.1890/090220
2011,Ecosphere,Cross-system comparisons elucidate disturbance complexities and generalities,10.1890/ES11-00115.1
2011,Urban Ecosystems,Social-ecological science in the humane metropolis,10.1007/s11252-011-0166-7
2011,Ecological Applications,Nitrate production and availability in residential soils,10.1890/10-2009.1
2011,Ecosystems,Accumulation of Carbon and Nitrogen in Residential Soils with Different Land-Use Histories,10.1007/s10021-010-9409-3
2011,Urban Ecosystems,The logistics and mechanics of conducting tracer injection experiments in urban streams,10.1007/s11252-010-0144-5
2011,Biological Invasions,Ecosystem effects of non-native earthworms in Mid-Atlantic deciduous forests,10.1007/s10530-011-9959-0
2011,Landscape and Urban Planning,Does spatial configuration matter? Understanding the effects of land cover pattern on land surface temperature in urban landscapes.,10.1016/j.landurbplan.2011.03.009
2011,Landscape Ecology,90 years of forest cover change in an urbanizing watershed: spatial and temporal dynamics,10.1007/s10980-011-9589-z
2012,Biochemical Systematics and Ecology,Genetic comparisons between North American and European populations of Lumbricus terrestris L,10.1016/j.bse.2012.07.018
2012,Ecological Engineering,Microbial biomass and activity in geomorphic features in forested and urban restored and degraded streams,10.1016/j.ecoleng.2011.09.001
2012,Urban Ecosystems,The urban watershed continuum: evolving spatial and temporal dimensions,10.1007/s11252-012-0226-7
2012,Ecological Monographs,"Influence of natural and novel organic carbon sources on denitrification in forest, degraded urban, and restored streams",10.1890/12-0458.1
2012,Landscape and Urban Planning,Urban landscape characteristics correlated with the synurbization of wildlife,10.1016/j.landurbplan.2012.04.003
2012,Ecosystems,Pharmaceutical Compounds and Ecosystem Function: An Emerging Research Challenge for Aquatic Ecologists,10.1007/s10021-012-9553-z
2012,Urban Ecosystems,Elevated chloride and consumer presence independently influence processing of stream detritus,10.1007/s11252-011-0210-7
2012,Landscape and Urban Planning,The relationship between tree canopy and crime rates across an urban–rural gradient in the greater Baltimore region,10.1016/j.landurbplan.2012.03.010
2012,Landscape Ecology,Effects of patch characteristics and within patch heterogeneity on the accuracy of urban land cover estimates from visual interpretation,10.1007/s10980-012-9780-x
2012,Urban Ecosystems,Ecological consequences of fragmentation and deforestation in an urban landscape: a case study,10.1007/s11252-012-0238-3
2013,Landscape and Urban Planning,"Covenants, cohesion, and community: The effects of neighborhood governance on lawn fertilization",10.1016/j.landurbplan.2013.02.013
2013,International Journal of Sustainable Development and World Ecology,"Preliminary results from monitoring of stream nitrogen concentrations, denitrification and nitrification potentials in an urbanizing watershed in Xiamen, Southeast China",10.1080/13504509.2013.782905
2013,Journal of Soil and Water Conservation,"Advancing water resource management in agricultural, rural, and urbanizing watersheds: Why land-grant universities matter",10.2489/jswc.68.4.337
2013,Frontiers in Ecology and the Environment,Socioecological revitalization of an urban watershed,10.1890/120069
2013,AoB PLANTS,Native and exotic earthworms affect orchid seed loss,10.1093/aobpla/plt018
2013,Landscape and Urban Planning,Assessing and comparing relationships between urban environmental stewardship networks and land cover in Baltimore and Seattle,10.1016/j.landurbplan.2013.08.008
2013,Ecology and Society,The Next Generation of Scientists: Examining the Experiences of Graduate Students in Network-Level Social-Ecological Science,10.5751/ES-05606-180342
2013,Ecological Applications,Pharmaceuticals suppress algal growth and microbial respiration and alter bacterial communities in stream biofilms,10.1890/12-0491.1
2013,Pedobiologia,Manipulating earthworm abundance using electroshocking in deciduous forests,10.1016/j.pedobi.2012.08.008
2013,Urban Ecosystems,Environmental stewardship footprint research: linking human agency and ecosystem health in the Puget Sound region,10.1007/s11252-011-0175-6
2014,Proceedings of the Royal Society B: Biological Sciences,A global analysis of the impacts of urbanization on bird and plant diversity reveals key anthropogenic drivers,10.1098/rspb.2013.3330
2014,Urban Ecosystems,The effect of earthworms on roadway-derived Zn deposited as a surface layer in storm water retention basin soils,10.1007/s11252-014-0355-2
2014,Landscape and Urban Planning,Advancing urban sustainability theory and action: Challenges and opportunities,10.1016/j.landurbplan.2014.01.022
2014,Landscape and Urban Planning,Using urban forest assessment tools to model bird habitat potential,10.1016/j.landurbplan.2013.10.006
2014,Molecular Ecology,Herbarium specimens reveal a historical shift in phylogeographic structure of common ragweed during native range disturbance,10.1111/mec.12675
2014,Ecosystems,“Hotspots” and “Hot Moments” of Denitrification in Urban Brownfield Wetlands,10.1007/s10021-014-9778-0
2014,Urban Ecosystems,Seasonal comparisons of daily activity budgets of gray squirrels (Sciurus carolinensis) in urban areas,10.1007/s11252-014-0371-2
2014,Ecosystems,Convergent Surface Water Distributions in U.S. Cities,10.1007/s10021-014-9751-y
2014,Frontiers in Ecology and the Environment,Urban ecology: advancing science and society,10.1890/140019
2015,Ecohydrology,Riparian community structure and soil properties of restored urban streams,10.1002/eco.1644
2015,Ecosystems,Climate Variation Overwhelms Efforts to Reduce Nitrogen Delivery to Coastal Waters,10.1007/s10021-015-9902-9
2015,Biogeosciences,Salinization alters fluxes of bioreactive elements from stream ecosystems across land use,10.5194/bg-12-7331-2015
2015,Landscape and Urban Planning,Effects of skeletal streetscape design on perceived safety,10.1016/j.landurbplan.2015.05.007
2015,Applied Vegetation Science,Human legacies differentially organize functional and phylogenetic diversity of urban herbaceous plant communities at multiple spatial scales,10.1111/avsc.12155
2015,Functional Ecology,The ecological foundations of transmission potential and vector-borne disease in urban landscapes,10.1111/1365-2435.12487
2015,Landscape and Urban Planning,"Multi-scale assessment of metal contamination in residential soil and soil fauna: A case study in the Baltimore-Washington metropolitan region, USA",10.1016/j.landurbplan.2015.05.001
2015,Ecological Modelling,Linking management to biodiversity in built ponds using metacommunity simulations,10.1016/j.ecolmodel.2014.10.022
2015,Global Ecology and Biogeography,The compositional similarity of urban forests among the world's cities is scale dependent,10.1111/geb.12376
2016,Frontiers in Ecology and the Environment,Networks and landscapes: a framework for setting goals and evaluating performance at the large landscape scale,10.1002/fee.1250
2016,Frontiers in Ecology and the Environment,Network governance for large-scale natural resource conservation and the challenge of capture,10.1002/fee.1252
2016,Ecology,Belowground competition among invading detritivores,10.1890/15-0551.1
2016,Freshwater Biology,A novel method to assess effects of chemical stressors on natural biofilm structure and function,10.1111/fwb.12641
2016,Landscape Ecology,Convergence of microclimate in residential landscapes across diverse cities in the United States,10.1007/s10980-015-0297-y
2016,Landscape Ecology,"People, landscape, and urban heat island: dynamics among neighborhood social conditions, land cover and surface temperatures",10.1007/s10980-016-0437-z
2016,Global Ecology and Biogeography,Climate tolerances and trait choices shape continental patterns of urban tree biodiversity,10.1111/geb.12499
2016,Conservation Biology,Studying citizen science through adaptive management and learning feedbacks as mechanisms for improving conservation,10.1111/cobi.12659
2016,Ecosphere,Demystifying governance and its role for transitions in urban social–ecological systems,10.1002/ecs2.1564
2016,Ecology,Belowground interactions with aboveground consequences: Invasive earthworms and arbuscular mycorrhizal fungi,10.1890/15-1085
2016,Ecology and Society,Graduate students navigating social-ecological research: insights from the Long-Term Ecological Research Network,10.5751/ES-08111-210107
2016,Freshwater Science,Antidepressants in stream ecosystems: influence of selective serotonin reuptake inhibitors (SSRIs) on algal production and insect emergence,10.1086/687841
2016,Oecologia,Plant nitrogen concentration and isotopic composition in residential lawns across seven US cities,10.1007/s00442-016-3566-9
2016,Landscape and Urban Planning,The relationship between residential yard management and neighborhood crime: An analysis from Baltimore City and County,10.1016/j.landurbplan.2015.11.004
2016,Ecosystems,Frontiers in ecosystem ecology from a community perspective: The future is boundless and bright,10.1007/s10021-016-9967-0
2016,Urban Ecosystems,"The effects of landscape cover on surface soils in a low density residential neighborhood in Baltimore, Maryland",10.1007/s11252-015-0502-4
2017,Freshwater Biology,Urban infrastructure influences dissolved organic matter quality and bacterial metabolism in an urban stream network,10.1111/fwb.13035
2017,Frontiers in Ecology and the Environment,Synthetic chemicals as agents of global change,10.1002/fee.1450
2017,Landscape and Urban Planning,Where to plant urban trees? A spatially explicit methodology to explore ecosystem service tradeoffs,10.1016/j.landurbplan.2016.08.016
2017,Nature Ecology and Evolution,Urbanization erodes ectomycorrhizal fungal diversity and may cause microbial communities to converge,10.1038/s41559-017-0123
2017,Nature Ecology and Evolution,Ecological homogenization of residential macrosystems,10.1038/s41559-017-0191
2017,Ecosystems,Moving Towards a New Urban Systems Science,10.1007/s10021-016-0053-4
2017,Ecological Economics,"Do Stormwater Basins Generate co-Benefits? Evidence from Baltimore County, Maryland",10.1016/j.ecolecon.2017.05.030
2017,Frontiers in Ecology and the Environment,“Accidental” urban wetlands: ecosystem functions in unexpected places,10.1002/fee.1494
2017,Urban Ecosystems,Dynamic heterogeneity: a framework to promote ecological integration and hypothesis generation in urban systems,10.1007/s11252-016-0574-9
2017,Landscape Ecology,How many principles of urban ecology are there?,10.1007/s10980-017-0492-0
2017,Urban Ecosystems,Forest cover is important across multiple scales for bird communities in vacant lots,10.1007/s11252-016-0614-5
2017,Ecosphere,Recovery and resilience of urban stream metabolism following Superstorm Sandy and other floods,10.1002/ecs2.1776
2017,Biogeosciences,Influence of infrastructure on water quality and greenhouse gas dynamics in urban streams,10.5194/bg-14-2831-2017
2017,Landscape and Urban Planning,Continental-scale homogenization of residential lawn plant communities,10.1016/j.landurbplan.2017.05.004
2017,Landscape Ecology,Shifting concepts of urban spatial heterogeneity and their implications for sustainability,10.1007/s10980-016-0432-4
2018,Ecological Engineering,Soil and microbial properties of green infrastructure stormwater management systems,10.1016/j.ecoleng.2018.10.017
2018,Landscape and Urban Planning,A multi-city comparison of front and backyard differences in plant species diversity and nitrogen cycling in residential landscapes,10.1016/j.landurbplan.2018.05.030
2018,Ecosphere,"Homogenization of plant diversity, composition, and structure in North American urban yards",10.1002/ecs2.2105
2018,Biogeosciences,Ideas and perspectives: Strengthening the biogeosciences in environmental research networks,10.5194/bg-15-4815-2018
2018,Ecosphere,Urban stream microbial communities show resistance to pharmaceutical exposure,10.1002/ecs2.2041
2018,Landscape and Urban Planning,Six fundamental aspects for conceptualizing multidimensional urban form: A spatial mapping perspective,10.1016/j.landurbplan.2018.07.007
2018,Ecosphere,Sediment chemistry of urban stormwater ponds and controls on denitrification,10.1002/ecs2.2318
2018,Ecology,Phosphorus limitation of aboveground production in northern hardwood forests,10.1002/ecy.2100
2018,Journal of Ecology,"Snow depth, soil temperature and plant–herbivore interactions mediate plant response to climate change",10.1111/1365-2745.12912
2018,Ecological Modelling,A test of functional convergence in carbon fluxes from coupled C and N cycles in Arctic tundra,10.1016/j.ecolmodel.2018.05.017
2018,Ecological Monographs,Partitioning assimilatory nitrogen uptake in streams: an analysis of stable isotope tracer additions across continents,10.1002/ecm.1280
2018,Ecosphere,Effect of particle size and heterogeneity on sediment biofilm metabolism and nutrient uptake scaled using two approaches,10.1002/ecs2.2137
2018,Global Change Biology,Solar-induced chlorophyll fluorescence is strongly correlated with terrestrial photosynthesis for a wide variety of biomes: First global analysis based on OCO-2 and flux tower observations,10.1111/gcb.14297
2018,Current Opinion in Insect Science,Global change and the importance of fire for the ecology and evolution of insects,10.1016/j.cois.2018.07.015
2018,Freshwater Biology,A changing menu in a changing climate: Using experimental and long-term data to predict invertebrate prey biomass and availability in lakes of arctic Alaska,10.1111/fwb.13162
2018,Global Change Biology,Linking permafrost thaw to shifting biogeochemistry and food web resources in an arctic river,10.1111/gcb.14448
2018,Oikos,Long-term nutrient addition alters arthropod community composition but does not increase total biomass or abundance,10.1111/oik.04398
2017,Ecosystems,Modeling for Understanding v. Modeling for Numbers,10.1007/s10021-016-0067-y
2017,Ecology and Evolution,A gradient of nutrient enrichment reveals nonlinear impacts of fertilization on Arctic plant diversity and ecosystem function,10.1002/ece3.2863
2017,Ecology,Shrub encroachment in Arctic tundra: Betula nana effects on above- and belowground litter decomposition,10.1002/ecy.1790
2017,Ecosystems,Long-Term Release of Carbon Dioxide from Arctic Tundra Ecosystems in Alaska,10.1007/s10021-016-0085-9
2017,Functional Ecology,Biogenic silica accumulation varies across tussock tundra plant functional type,10.1111/1365-2435.12912
2017,Oecologia,Extreme spring conditions in the Arctic delay spring phenology of long-distance migratory songbirds,10.1007/s00442-017-3907-3
2017,Global Change Biology,Arctic shrub growth trajectories differ across soil moisture levels,10.1111/gcb.13677
2016,Ecosphere,Emerging opportunities and challenges in phenology: a review,10.1002/ecs2.1436
2016,Landscape Ecology,C–N–P interactions control climate driven changes in regional patterns of C storage on the North Slope of Alaska,10.1007/s10980-015-0266-5
2015,Biogeosciences,Reviews and syntheses: Effects of permafrost thaw on Arctic aquatic ecosystems,10.5194/bg-12-7129-2015
2015,Ecosystems,Ecosystem’s 80th and the Reemergence of Emergence,10.1007/s10021-015-9893-6
2015,Global Change Biology,Northward displacement of optimal climate conditions for ecotypes of Eriophorum vaginatum L. across a latitudinal gradient in Alaska,10.1111/gcb.12991
2015,Biogeosciences,"The role of watershed characteristics, permafrost thaw, and wildfire on dissolved organic carbon biodegradability and water chemistry in Arctic headwater streams",10.5194/bg-12-4221-2015
2015,Biogeosciences,Controls on dissolved organic matter (DOM) degradation in a headwater stream: the influence of photochemical and hydrological conditions in determining light-limitation or substrate-limitation of photo-degradation,10.5194/bg-12-6669-2015
2015,Marine Ecology Progress Series,Seasonal changes in quantity and composition of suspended particulate organic matter in lagoons of the Alaskan Beaufort Sea,10.3354/meps11207
2015,Biogeosciences,Spatiotemporal patterns of tundra fires: late-Quaternary charcoal records from Alaska,10.5194/bg-12-4017-2015
